{
  "schema_version": 2,
  "project": {
    "id": "synthetic-empirical",
    "question": "SYNTHETIC: does a routing intervention change an invented retrieval response?",
    "research_type": "empirical",
    "constraints": {
      "budget": {
        "status": "confirmed",
        "value": "One fictional local reasoning task",
        "source": "SYNTHETIC demonstration; not a user commitment"
      }
    },
    "assumptions": []
  },
  "config": {
    "ranking_weights": {
      "scientific_value": 40,
      "differentiation": 35,
      "testability": 25
    }
  },
  "searches": [
    {
      "id": "S1",
      "query": "SYNTHETIC check of one fictional record",
      "provider": "synthetic_fixture",
      "searched_at": "2026-10-05T08:00:00Z",
      "status": "complete",
      "scope": "Fictional corpus only; no real retrieval",
      "limitations": [
        "SYNTHETIC: no real search or scientific evidence"
      ],
      "result_paper_ids": [
        "P1"
      ]
    }
  ],
  "papers": [
    {
      "id": "P1",
      "title": "SYNTHETIC SOURCE — NOT A REAL PAPER",
      "year": null,
      "url": "https://example.invalid/synthetic-source",
      "identifiers": {},
      "version": "fictional version",
      "accessed_at": "2026-10-05T08:00:00Z"
    }
  ],
  "screening": [
    {
      "id": "SC1",
      "search_id": "S1",
      "paper_id": "P1",
      "idea_ids": [
        "I1"
      ],
      "stage": "title_abstract",
      "decision": "include",
      "reason": "Fictional example relevance; no real screening",
      "screened_at": "2026-10-05T08:00:00Z"
    }
  ],
  "evidence": [
    {
      "id": "E1",
      "paper_id": "P1",
      "source_version": "fictional version",
      "read_scope": "section",
      "locator": "Fictional section 1",
      "observation": "An invented retrieval failure motivates a comparison; no real result exists.",
      "polarity": "context"
    }
  ],
  "ideas": [
    {
      "id": "I1",
      "version": 1,
      "title": "SYNTHETIC empirical candidate",
      "question": "SYNTHETIC: does a routing intervention change an invented retrieval response?",
      "research_type": "empirical",
      "hypothesis": "In the invented setting, routing changes the specified response beyond a simple control.",
      "contribution": "A fictional conditional mechanism comparison.",
      "evidence_ids": [
        "E1"
      ],
      "evidence_links": [
        {
          "evidence_id": "E1",
          "role": "motivation",
          "target": "problem",
          "claim": "The fictional prior understanding sufficiently describes this invented setting",
          "relation": "context",
          "decision_relevant": true
        }
      ],
      "search_ids": [
        "S1"
      ],
      "nearest_work": [
        {
          "paper_id": "P1",
          "evidence_ids": [
            "E1"
          ],
          "delta": "An invented condition differs; no real novelty is claimed",
          "decisive": true
        }
      ],
      "novelty": {
        "status": "incremental",
        "reason": "SYNTHETIC schema illustration only",
        "coverage": "One fictional record; no real-world claim"
      },
      "feasibility": {
        "status": "ready",
        "reason": "Only a fictional local task is declared",
        "dependencies": [
          {
            "name": "Fictional budget",
            "mandatory": true,
            "status": "met",
            "basis": "Synthetic demonstration only"
          }
        ]
      },
      "validation": {
        "status": "specified",
        "prediction": "In the invented setting, routing changes the specified response beyond a simple control.",
        "falsifier": "The prespecified opposite result or counterexample occurs",
        "design": "Compare matched invented inputs under simple and routed conditions; keep budgets equal.",
        "metric": "Synthetic response difference with a prespecified uncertainty rule",
        "resource_estimate": "One fictional task; no GPU or actual time commitment",
        "stop_rule": "Stop at the fictional budget or decisive result; execution failure is separate"
      }
    }
  ],
  "reviews": [
    {
      "id": "R1",
      "idea_id": "I1",
      "idea_version": 1,
      "review_basis_hash": "a8bce953e0f060ed4a7359a905fd3f84c4096787a51b23316d8b1ccc50f5ba4d",
      "reviewed_at": "2026-10-05T08:00:00Z",
      "kind": "self",
      "decision": "GO",
      "decision_scope": "scientific_framing",
      "recommended_stage": "pilot",
      "decision_basis": {
        "type": "advance",
        "evidence_ids": [
          "E1"
        ],
        "pilot_ids": [],
        "dependency_names": [],
        "constraint_keys": [],
        "explanation": "SYNTHETIC: illustrates a record state, not a scientific endorsement"
      },
      "reason": "SYNTHETIC demonstration only; never reuse as scientific evidence",
      "scores": {
        "scientific_value": 2,
        "differentiation": 2,
        "testability": 2
      },
      "score_reasons": {
        "scientific_value": "Fictional illustration",
        "differentiation": "Fictional illustration",
        "testability": "Fictional illustration"
      },
      "penalties": [],
      "limitations": [
        "SYNTHETIC EXAMPLE — NOT A REAL SCIENTIFIC CLAIM",
        "No real paper, retrieval, validation, or expert review"
      ]
    }
  ],
  "pilots": [],
  "history": []
}
